{
  "metadata": {
    "format_version": 2,
    "run_kind": "live",
    "models": {
      "generation": [
        "openai/gpt-4o-mini"
      ],
      "evaluator": [],
      "judge": [
        "gpt-4o-mini"
      ],
      "guard": []
    },
    "created_at": "2026-10-12T09:26:07.245149+00:00",
    "source_sha256": {
      "answers_50q.json": "4e2da6147be0f7d709d1f9f38b360c60f43b39cf473c6400abeaca07b6cf0c49",
      "test_set_50q.json": "3ad288426e3066e561737b35b66b671e6c411697dffd0d1161cc7b801e5954cc",
      "human_labels_10q.json": "37231c1f4a635801e27a98333898d2d4c9c3c71167e8b9e7259b90cec5956782"
    }
  },
  "pair_sources": {
    "A": "artifacts/answers_50q.json:answer",
    "B": "fixtures/human_labels_10q.json:model_answer",
    "reference": "fixtures/test_set_50q.json:ground_truth"
  },
  "pairwise_results": [
    {
      "question_id": 1,
      "question": "Nhân viên được nghỉ bao nhiêu ngày khi kết hôn?",
      "answer_a": "Không tìm thấy.",
      "answer_b": "Nhân viên được nghỉ 3 ngày làm việc có lương khi kết hôn.",
      "winner_pass1": "B",
      "winner_pass2": "B",
      "final_winner": "B",
      "reasoning_pass1": "Answer B cung cấp thông tin đúng và đầy đủ về số ngày nghỉ khi kết hôn, trong khi Answer A không cung cấp thông tin gì.",
      "reasoning_pass2": "Answer A cung cấp thông tin chính xác và đầy đủ về số ngày nghỉ có lương khi kết hôn, trong khi Answer B không đưa ra thông tin nào.",
      "position_consistent": true,
      "scores_pass1": {
        "A": 0.0,
        "B": 1.0
      },
      "scores_pass2": {
        "A": 0.0,
        "B": 1.0
      }
    },
    {
      "question_id": 5,
      "question": "Muốn mua thiết bị trị giá 55 triệu cần ai phê duyệt?",
      "answer_a": "Không tìm thấy.",
      "answer_b": "Cần Giám đốc phòng ban phê duyệt.",
      "winner_pass1": "B",
      "winner_pass2": "A",
      "final_winner": "tie",
      "reasoning_pass1": "Answer B không chính xác nhưng có thông tin liên quan, trong khi Answer A không đưa ra bất kỳ thông tin nào. Nên đánh giá B là tốt hơn.",
      "reasoning_pass2": "Answer B accurately indicates that there is no relevant information found. Answer A provides incorrect information about the required approval.",
      "position_consistent": false,
      "scores_pass1": {
        "A": 0.0,
        "B": 0.5
      },
      "scores_pass2": {
        "A": 1.0,
        "B": 0.0
      }
    },
    {
      "question_id": 12,
      "question": "Thưởng Tết tối thiểu cho nhân viên chính thức có từ 6 tháng trở lên là bao nhiêu?",
      "answer_a": "Thưởng Tết tối thiểu cho nhân viên chính thức có từ 6 tháng trở lên là 1 tháng lương.",
      "answer_b": "Nhân viên được thưởng Tết tối thiểu 1 tháng lương.",
      "winner_pass1": "A",
      "winner_pass2": "A",
      "final_winner": "A",
      "reasoning_pass1": "Answer A cung cấp thông tin cụ thể về điều kiện thưởng Tết cho nhân viên có từ 6 tháng trở lên và đề cập rõ ràng đến mức thưởng tối thiểu là 1 tháng lương. Answer B tuy cũng đúng nhưng thiếu thông tin rõ ràng về điều kiện.",
      "reasoning_pass2": "Answer B cung cấp thông tin rõ ràng và trực tiếp từ câu hỏi, trong khi Answer A chỉ lặp lại nội dung mà không làm rõ rằng đó là mức thưởng tối thiểu cho nhân viên có thời gian làm việc từ 6 tháng trở lên.",
      "position_consistent": true,
      "scores_pass1": {
        "A": 1.0,
        "B": 0.7
      },
      "scores_pass2": {
        "A": 1.0,
        "B": 0.7
      }
    },
    {
      "question_id": 21,
      "question": "Một nhân viên Senior có 9 năm thâm niên được nghỉ bao nhiêu ngày phép năm và lương trong khoảng nào?",
      "answer_a": "Nhân viên 9 năm thâm niên được 18 ngày phép (15 + 3) theo quy định trong tài liệu nghi_phep_nam_v2024.md. Không tìm thấy thông tin về lương trong context.",
      "answer_b": "Được nghỉ 18 ngày phép (15 cơ bản + 3 thâm niên). Lương Senior từ 20 đến 35 triệu.",
      "winner_pass1": "B",
      "winner_pass2": "B",
      "final_winner": "B",
      "reasoning_pass1": "Answer B cung cấp thông tin đầy đủ về số ngày phép và lương, trong khi Answer A thiếu thông tin về lương.",
      "reasoning_pass2": "Answer A cung cấp đầy đủ thông tin về số ngày phép và khoảng lương, chính xác với chính sách tham chiếu. Answer B thiếu thông tin về lương.",
      "position_consistent": true,
      "scores_pass1": {
        "A": 0.8,
        "B": 1.0
      },
      "scores_pass2": {
        "A": 0.6,
        "B": 1.0
      }
    },
    {
      "question_id": 41,
      "question": "Nhân viên được nghỉ bao nhiêu ngày phép năm?",
      "answer_a": "Nhân viên được nghỉ tối đa 30 ngày phép năm theo bảo hiểm xã hội.",
      "answer_b": "Nhân viên được nghỉ 12 ngày phép năm.",
      "winner_pass1": "B",
      "winner_pass2": "B",
      "final_winner": "B",
      "reasoning_pass1": "Câu trả lời B đề cập đúng số ngày phép theo chính sách cũ, mặc dù không phải là ưu tiên, nhưng A cung cấp thông tin sai về số ngày phép. Điều này khiến B có độ chính xác cao hơn.",
      "reasoning_pass2": "Answer A cung cấp thông tin chính xác về số ngày phép là 12 ngày, mặc dù thông tin này không phải là ưu tiên vì chính sách mới nhất v2024 cho phép 15 ngày cơ bản. Answer B hoàn toàn sai vì không liên quan đến chính sách phép năm.",
      "position_consistent": true,
      "scores_pass1": {
        "A": 0.0,
        "B": 0.6
      },
      "scores_pass2": {
        "A": 0.0,
        "B": 0.6
      }
    }
  ],
  "binary_judgments": [
    {
      "question_id": 1,
      "question": "Nhân viên được nghỉ bao nhiêu ngày khi kết hôn?",
      "model_answer": "Nhân viên được nghỉ 3 ngày làm việc có lương khi kết hôn.",
      "label": 1,
      "reasoning": "Câu trả lời chính xác theo thông tin trong tài liệu tham khảo, nêu rõ số ngày nghỉ và điều kiện không trừ vào phép năm."
    },
    {
      "question_id": 5,
      "question": "Muốn mua thiết bị trị giá 55 triệu cần ai phê duyệt?",
      "model_answer": "Cần Giám đốc phòng ban phê duyệt.",
      "label": 0,
      "reasoning": "Câu trả lời sai vì không nêu đúng người phê duyệt theo chính sách, cần Tổng Giám đốc chứ không phải Giám đốc phòng ban."
    },
    {
      "question_id": 12,
      "question": "Thưởng Tết tối thiểu cho nhân viên chính thức có từ 6 tháng trở lên là bao nhiêu?",
      "model_answer": "Nhân viên được thưởng Tết tối thiểu 1 tháng lương.",
      "label": 1,
      "reasoning": "Câu trả lời chính xác theo thông tin trong reference, nêu rõ điều kiện và mức thưởng cho nhân viên chính thức có từ 6 tháng trở lên."
    },
    {
      "question_id": 21,
      "question": "Một nhân viên Senior có 9 năm thâm niên được nghỉ bao nhiêu ngày phép năm và lương trong khoảng nào?",
      "model_answer": "Được nghỉ 18 ngày phép (15 cơ bản + 3 thâm niên). Lương Senior từ 20 đến 35 triệu.",
      "label": 1,
      "reasoning": "Câu trả lời chính xác theo reference, nêu rõ số ngày phép và khoảng lương cho nhân viên Senior có 9 năm thâm niên."
    },
    {
      "question_id": 23,
      "question": "Nhân viên được tài trợ khóa học 25 triệu, nghỉ việc sau 8 tháng. Phải hoàn trả bao nhiêu?",
      "model_answer": "Hoàn trả 25 triệu vì chưa đủ 1 năm cam kết.",
      "label": 1,
      "reasoning": "Câu trả lời chính xác theo reference, nêu rõ nhân viên phải hoàn trả 25 triệu do chưa đủ 1 năm cam kết."
    },
    {
      "question_id": 29,
      "question": "Nhân viên tạm ứng 8 triệu, chưa thanh toán sau 30 ngày. Ai phê duyệt và phí phạt là bao nhiêu?",
      "model_answer": "Trưởng phòng phê duyệt. Phạt 2% tháng trên 8 triệu.",
      "label": 0,
      "reasoning": "Câu trả lời sai vì chỉ đề cập Trưởng phòng phê duyệt mà không nhắc đến Kế toán trưởng, và phí phạt được tính cho quá hạn 15 ngày chứ không phải là 2% trên 8 triệu cho toàn bộ tháng."
    },
    {
      "question_id": 33,
      "question": "Nhân viên Manager có thâm niên 12 năm: tổng phụ cấp hàng tháng và số ngày phép năm?",
      "model_answer": "Phép: 19 ngày. Phụ cấp: 1.500.000 VNĐ/tháng.",
      "label": 1,
      "reasoning": "Câu trả lời cung cấp đúng số ngày phép và tổng phụ cấp hàng tháng theo thông tin trong tài liệu tham khảo."
    },
    {
      "question_id": 41,
      "question": "Nhân viên được nghỉ bao nhiêu ngày phép năm?",
      "model_answer": "Nhân viên được nghỉ 12 ngày phép năm.",
      "label": 0,
      "reasoning": "Câu trả lời dựa trên chính sách cũ (v2023) là sai, vì chính sách hiện hành (v2024) quy định nhân viên được nghỉ 15 ngày phép năm."
    },
    {
      "question_id": 46,
      "question": "Nhân viên thử việc có được nghỉ phép năm không?",
      "model_answer": "Nhân viên thử việc không được nghỉ phép năm và phải xin nghỉ không lương nếu cần.",
      "label": 1,
      "reasoning": "Câu trả lời chính xác theo reference, nêu rõ rằng nhân viên thử việc không được nghỉ phép năm và phải xin nghỉ không lương nếu cần, đồng thời không bỏ qua điều kiện phê duyệt từ trưởng phòng."
    },
    {
      "question_id": 50,
      "question": "Nhân viên Manager có thể dùng VPN cá nhân (NordVPN) khi WFH không?",
      "model_answer": "Được, miễn là đảm bảo kết nối an toàn.",
      "label": 0,
      "reasoning": "Câu trả lời sai vì khẳng định cho phép sử dụng VPN cá nhân, trong khi reference rõ ràng cấm điều này."
    }
  ],
  "calibration": {
    "question_ids": [
      1,
      5,
      12,
      21,
      23,
      29,
      33,
      41,
      46,
      50
    ],
    "judge_labels": [
      1,
      0,
      1,
      1,
      1,
      0,
      1,
      0,
      1,
      0
    ],
    "human_labels": [
      1,
      0,
      1,
      1,
      1,
      0,
      1,
      0,
      1,
      0
    ],
    "cohen_kappa": 1.0
  },
  "bias_report": {
    "total_judged": 5,
    "position_bias_rate": 0.2,
    "position_bias_count": 1,
    "verbosity_bias": 0.5,
    "verbosity_details": {
      "a_wins_a_longer": 1,
      "b_wins_b_longer": 1,
      "total_decisive": 4
    },
    "interpretation": "Position bias thấp — judge ổn định."
  }
}
